Link_Candidato,Experiencia,Pontuacao_Conhecimentos,Pontuacao_Habilidades,Pontuacao_Atitudes,Pontuacao_Final,Porcentagem
https://scrap-example.onrender.com/scraping.html25,arquiteto de software pleno,0,2,0,2,4.88
https://scrap-example.onrender.com/scraping.html5,analista de banco de dados pleno,0,2,0,2,4.88
https://scrap-example.onrender.com/scraping.html53,arquiteto de soluções em cloud,0,1,0,1,2.44
https://scrap-example.onrender.com/scraping.html43,arquiteta de soluções cloud,0,1,0,1,2.44
https://scrap-example.onrender.com/scraping.html49,engenheiro de dados,0,1,0,1,2.44
https://scrap-example.onrender.com/scraping.html22,analista de dados pleno,0,1,0,1,2.44
https://scrap-example.onrender.com/scraping.html29,analista de qualidade de software júnior,0,1,0,1,2.44
https://scrap-example.onrender.com/scraping.html52,designer ui e desenvolvedor front-end,0,1,0,1,2.44
